tmdb_id,adult,belongs_to_collection,collection_id,budget,genres,overview,production_company_id,production_company_name,release_month,release_year,revenue,tagline,director,actor_0_name,actor_0_id,actor_0_gender,actor_1_name,actor_1_id,actor_1_gender,actor_2_name,actor_2_id,actor_2_gender,actor_3_name,actor_3_id,actor_3_gender,actor_4_name,actor_4_id,actor_4_gender
73,False,False,,20000000,['Drama'],"Derek Vineyard is paroled after serving 3 years in prison for killing two African-American men. Through his brother, Danny Vineyard's narration, we learn that before going to prison, Derek was a skinhead and the leader of a violent white supremacist gang that committed acts of racial crime throughout L.A. and his actions greatly influenced Danny. Reformed and fresh out of prison, Derek severs contact with the gang and becomes determined to keep Danny from going down the same violent path as he did.",12,New Line Cinema,7,1998,23900000,Some Legacies Must End.,Tony Kaye,Edward Norton,819,2,Edward Furlong,820,2,Beverly D'Angelo,821,1,Jennifer Lien,823,1,Ethan Suplee,824,2
1957,False,False,,38000000,"['Drama', 'Thriller']","Working-class waitress Slim thought she was entering a life of domestic bliss when she married Mitch, the man of her dreams. After the arrival of their first child, her picture perfect life is shattered when she discovers Mitch's hidden possessive dark side, a controlling and abusive alter ego that can turn trust, love and tranquility into terror. Terrified for her child's safety, Slim flees with her daughter. Relentless in his pursuit and enlisting the aid of lethal henchmen, Mitch continually stalks the prey that was once his family.",8880,Winkler Films,5,2002,51800000,Everyone has a limit.,Michael Apted,Jennifer Lopez,16866,1,Billy Campbell,20215,2,Juliette Lewis,3196,1,Dan Futterman,5346,2,Fred Ward,10430,2
168672,False,False,,40000000,"['Drama', 'Crime']","A conman and his seductive partner are forced to work for a wild FBI agent, who pushes them into a world of Jersey power-brokers and the Mafia.",13184,Annapurna Pictures,12,2013,251171807,Everyone hustles to survive.,David O. Russell,Christian Bale,3894,2,Bradley Cooper,51329,2,Amy Adams,9273,1,Jeremy Renner,17604,2,Jennifer Lawrence,72129,1
15196,False,False,,15000000,"['Comedy', 'Thriller', 'Crime', 'Mystery']","Clue finds six colorful dinner guests gathered at the mansion of their host, Mr. Boddy -- who turns up dead after his secret is exposed: He was blackmailing all of them. With the killer among them, the guests and Boddy's chatty butler must suss out the culprit before the body count rises.",498,Debra Hill Productions,12,1985,14643997,It's not just a game anymore.,John Landis,Tim Curry,13472,2,Eileen Brennan,39015,1,Madeline Kahn,29803,1,Christopher Lloyd,1062,2,Michael McKean,21731,2
4147,False,False,,80000000,"['Crime', 'Drama', 'Thriller']","Mike Sullivan works as a hit man for crime boss John Rooney. Sullivan views Rooney as a father figure, however after his son is witness to a killing, Mike Sullivan finds himself on the run in attempt to save the life of his son and at the same time looking for revenge on those who wronged him.",7,DreamWorks Pictures,7,2002,181001478,Pray for Michael Sullivan.,Sam Mendes,Tom Hanks,31,2,Tyler Hoechlin,78198,2,Paul Newman,3636,2,Jude Law,9642,2,Daniel Craig,8784,2
760161,False,True,760193,10000000,"['Horror', 'Thriller']","After escaping from an Estonian psychiatric facility, Leena Klammer travels to America by impersonating Esther, the missing daughter of a wealthy family. But when her mask starts to slip, she is put against a mother who will protect her family from the murderous “child” at any cost.",1786,Dark Castle Entertainment,7,2022,9572765,There's always been something wrong with Esther.,William Brent Bell,Isabelle Fuhrman,77517,1,Julia Stiles,12041,1,Rossif Sutherland,58014,2,Hiro Kanagawa,60719,2,Matthew Finlan,2563029,2
598,False,False,,3300000,"['Drama', 'Crime']","In the slums of Rio, two kids' paths diverge as one struggles to become a photographer and the other a kingpin.",345,O2 Filmes,8,2002,30641770,"If you run, the beast catches you; if you stay, the beast eats you.",Fernando Meirelles,Alexandre Rodrigues,8595,2,Leandro Firmino,8596,2,Phellipe Haagensen,8597,2,Seu Jorge,5659,2,Jonathan Haagensen,8599,2
273248,False,False,,44000000,"['Drama', 'Mystery', 'Western']",Bounty hunters seek shelter from a raging blizzard and get caught up in a plot of betrayal and deception.,308,The Weinstein Company,12,2015,155760117,No one comes up here without a damn good reason.,Quentin Tarantino,Samuel L. Jackson,2231,2,Kurt Russell,6856,2,Jennifer Jason Leigh,10431,1,Walton Goggins,27740,2,Demián Bichir,76961,2
597208,False,False,,60000000,"['Crime', 'Thriller', 'Drama']",An ambitious carnival man with a talent for manipulating people with a few well-chosen words hooks up with a female psychologist who is even more dangerous than he is.,127929,Searchlight Pictures,12,2021,39629195,Man or beast.,Guillermo del Toro,Bradley Cooper,51329,2,Cate Blanchett,112,1,Toni Collette,3051,1,Willem Dafoe,5293,2,Richard Jenkins,28633,2
9291,False,False,,82000000,"['Drama', 'Comedy', 'Crime']","Disgraced pro football quarterback Paul Crewe lands in a Texas federal penitentiary, where manipulative Warden Hazen recruits him to advise the institution's football team of prison guards. Crewe suggests a tune-up game which lands him quarterbacking a crew of inmates in a game against the guards. Aided by incarcerated ex-NFL coach and player Nate Scarborough, Crewe and his team must overcome not only the bloodthirstiness of the opposition, but also the corrupt warden trying to fix the game against them.",60378,Callahan Filmworks,5,2005,190300000,"If you can't get out, get even.",Anne Fletcher,Adam Sandler,19292,2,Chris Rock,2632,2,James Cromwell,2505,2,Burt Reynolds,16475,2,Nelly,69128,2
395834,False,True,1046516,11000000,"['Crime', 'Drama', 'Mystery', 'Thriller']",An FBI agent teams with the town's veteran game tracker to investigate a murder that occurred on a Native American reservation.,100460,Savvy Media Holdings,8,2017,44998252,Nothing is harder to track than the truth.,Peter Berg,Jeremy Renner,17604,2,Elizabeth Olsen,550843,1,Gil Birmingham,84225,2,Graham Greene,6804,2,Jon Bernthal,19498,2
392044,False,True,735384,55000000,"['Mystery', 'Drama', 'Crime']",Genius Belgian detective Hercule Poirot investigates the murder of an American tycoon aboard the Orient Express train.,1557,The Mark Gordon Company,11,2017,352800000,Everyone is a suspect.,Ridley Scott,Kenneth Branagh,11181,2,Tom Bateman,1364004,2,Michelle Pfeiffer,1160,1,Johnny Depp,85,2,Josh Gad,54415,2
75656,False,True,382685,75000000,"['Thriller', 'Crime']",An FBI agent and an Interpol detective track a team of illusionists who pull off bank heists during their performances and reward their audiences with the money.,491,Summit Entertainment,5,2013,351700000,"The closer you look, the less you’ll see.",Louis Leterrier,Jesse Eisenberg,44735,2,Mark Ruffalo,103,2,Woody Harrelson,57755,2,Isla Fisher,52848,1,Dave Franco,54697,2
524,False,False,,50000000,"['Crime', 'Drama', 'History']","In early-1970s Las Vegas, Sam ""Ace"" Rothstein gets tapped by his bosses to head the Tangiers Casino. At first, he's a great success in the job, but over the years, problems with his loose-cannon enforcer Nicky Santoro, his ex-hustler wife Ginger, her con-artist ex Lester Diamond and a handful of corrupt politicians put Sam in ever-increasing danger.",33,Universal Pictures,11,1995,116112375,No one stays at the top forever.,Martin Scorsese,Robert De Niro,380,2,Sharon Stone,4430,1,Joe Pesci,4517,2,James Woods,4512,2,Don Rickles,7167,2
319,False,False,,12500000,"['Action', 'Crime', 'Romance']","Clarence marries hooker Alabama, steals cocaine from her pimp, and tries to sell it in Hollywood, while the owners of the coke try to reclaim it.",10210,Morgan Creek Entertainment,9,1993,12600000,Stealing. Cheating. Killing. Who said romance was dead?,Quentin Tarantino,Christian Slater,2224,2,Patricia Arquette,4687,1,Michael Rapaport,4688,2,Bronson Pinchot,4689,2,Gary Oldman,64,2
338766,False,False,,12000000,"['Western', 'Crime', 'Drama']",A divorced dad and his ex-con brother resort to a desperate scheme in order to save their family's farm in West Texas.,737,Sidney Kimmel Entertainment,8,2016,37600000,Blood always follows money.,David Mackenzie,Jeff Bridges,1229,2,Chris Pine,62064,2,Ben Foster,11107,2,Gil Birmingham,84225,2,Marin Ireland,164094,1
242582,False,False,,8500000,"['Crime', 'Drama', 'Thriller']","When Lou Bloom, desperate for work, muscles into the world of L.A. crime journalism, he blurs the line between observer and participant to become the star of his own story. Aiding him in his effort is Nina, a TV-news veteran.",24049,Sierra/Affinity,10,2014,50300000,The city shines brightest at night,Richard L. Fox,Jake Gyllenhaal,131,2,Riz Ahmed,53240,2,Rene Russo,14343,1,Bill Paxton,2053,2,Kevin Rahm,97604,2
1592,False,False,,30000000,"['Crime', 'Drama', 'Mystery', 'Thriller']","An arrogant, high-powered attorney takes on the case of a poor altar boy found running away from the scene of the grisly murder of the bishop who has taken him in. The case gets a lot more complex when the accused reveals that there may or may not have been a third person in the room.",4,Paramount,3,1996,102600000,"Sooner or later, a man who wears two faces forgets which one is real.",Gregory Hoblit,Richard Gere,1205,2,Laura Linney,350,1,Edward Norton,819,2,John Mahoney,4251,2,Alfre Woodard,1981,1
1949,False,False,,65000000,"['Crime', 'Drama', 'Mystery', 'Thriller']",A cartoonist teams up with an ace reporter and a law enforcement officer to track down an elusive serial killer.,4,Paramount,3,2007,84785914,There's more than one way to lose your life to a killer.,David Fincher,Jake Gyllenhaal,131,2,Mark Ruffalo,103,2,Anthony Edwards,11085,2,Robert Downey Jr.,3223,2,Chloë Sevigny,2838,1
275,False,False,,7000000,"['Crime', 'Drama', 'Thriller']","Jerry, a small-town Minnesota car salesman is bursting at the seams with debt... but he's got a plan. He's going to hire two thugs to kidnap his wife in a scheme to collect a hefty ransom from his wealthy father-in-law. It's going to be a snap and nobody's going to get hurt... until people start dying. Enter Police Chief Marge, a coffee-drinking, parka-wearing - and extremely pregnant - investigator who'll stop at nothing to get her man. And if you think her small-time investigative skills will give the crooks a run for their ransom... you betcha!",1382,PolyGram Filmed Entertainment,3,1996,60611975,A lot can happen in the middle of nowhere.,Joel Coen,Frances McDormand,3910,1,William H. Macy,3905,2,Steve Buscemi,884,2,Peter Stormare,53,2,Harve Presnell,3907,2
10377,False,False,,11000000,['Comedy'],"Two carefree pals traveling through Alabama are mistakenly arrested, and charged with murder. Fortunately, one of them has a cousin who's a lawyer - Vincent Gambini, a former auto mechanic from Brooklyn who just passed his bar exam after his sixth try. When he arrives with his leather-clad girlfriend, to try his first case, it's a real shock - for him and the Deep South!",89303,Palo Vista Productions,3,1992,64088552,There have been many courtroom dramas that have glorified the Great American Legal System. This is not one of them.,Frank Capra III,Joe Pesci,4517,2,Ralph Macchio,2877,2,Marisa Tomei,3141,1,Mitchell Whitfield,19505,2,Fred Gwynne,56266,2
263472,False,False,,2500000,"['Thriller', 'Horror']","When a devoted husband and father is left home alone for the weekend, two stranded young women unexpectedly knock on his door for help. What starts out as a kind gesture results in a dangerous seduction and a deadly game of cat and mouse.",55497,Sobras International Pictures,6,2015,6341684,One night can cost you everything.,Eli Roth,Keanu Reeves,6384,2,Lorenza Izzo,1078608,1,Ana de Armas,224513,1,Aaron Burns,557303,2,Colleen Camp,13023,1
35849,False,False,,1154000,['Thriller'],"When composer George Harvey Bone wakes with no memory of the previous night and a bloody knife in his pocket, he worries that he has committed a crime. On the advice of Dr. Middleton, Bone agrees to relax, going to a music performance by singer Netta Longdon. Riveted by Netta, Bone agrees to write songs for her rather than his own concerto. However, Bone soon grows jealous of Netta and worries about controlling himself during his spells.",25,20th Century Fox,2,1945,1798500,THE SCREEN'S MOST Terrifying LOVE STORY! EXCITING MYSTERY AND STRANGE EMOTION!,John Brahm,Laird Cregar,80726,2,Linda Darnell,30289,1,George Sanders,3361,2,Glenn Langan,94202,2,Faye Marlowe,114828,1
138832,False,False,,37000000,"['Comedy', 'Crime']",A veteran pot dealer creates a fake family as part of his plan to move a huge shipment of weed into the U.S. from Mexico.,12,New Line Cinema,8,2013,270000000,If anyone asks.,Rawson Marshall Thurber,Jason Sudeikis,58224,2,Jennifer Aniston,4491,1,Emma Roberts,34847,1,Will Poulter,93491,2,Ed Helms,27105,2
819,False,False,,44000000,"['Crime', 'Drama', 'Thriller']",Two gangsters seek revenge on the state jail worker who during their stay at a youth prison sexually abused them. A sensational court hearing takes place to charge him for the crimes.,278,Propaganda Films,10,1996,165600000,Four friends have made a mistake that will change their lives forever.,Barry Levinson,Kevin Bacon,4724,2,Robert De Niro,380,2,Dustin Hoffman,4483,2,Jason Patric,12261,2,Brad Pitt,287,2
86838,False,False,,15000000,"['Comedy', 'Crime']",A struggling screenwriter inadvertently becomes entangled in the Los Angeles criminal underworld after his oddball friends kidnap a gangster's beloved Shih Tzu.,5490,CBS Films,10,2012,33035736,They Won't Take Any Shih Tzu.,Scott Peterson,Colin Farrell,72466,2,Sam Rockwell,6807,2,Woody Harrelson,57755,2,Christopher Walken,4690,2,Olga Kurylenko,18182,1
242,False,True,230,54000000,"['Crime', 'Drama', 'Thriller']","In the midst of trying to legitimize his business dealings in 1979 New York and Italy, aging mafia don, Michael Corleone seeks forgiveness for his sins while taking a young protege under his wing.",4,Paramount,12,1990,136766062,All the power on earth can't change destiny.,Francis Ford Coppola,Al Pacino,1158,2,Diane Keaton,3092,1,Talia Shire,3094,1,Andy García,1271,2,Eli Wallach,3265,2
23168,False,False,,37000000,"['Crime', 'Drama', 'Thriller']","Doug MacRay is a longtime thief, who, smarter than the rest of his crew, is looking for his chance to exit the game. When a bank job leads to the group kidnapping an attractive branch manager, he takes on the role of monitoring her – but their burgeoning relationship threatens to unveil the identities of Doug and his crew to the FBI Agent who is on their case.",923,Legendary Pictures,9,2010,154026136,Welcome to the bank robbery capital of America.,Sheila Waldron,Ben Affleck,880,2,Jeremy Renner,17604,2,Rebecca Hall,15556,1,Jon Hamm,65717,2,Blake Lively,59175,1
473033,False,False,,19000000,"['Drama', 'Thriller', 'Crime']","A charismatic New York City jeweler always on the lookout for the next big score makes a series of high-stakes bets that could lead to the windfall of a lifetime. Howard must perform a precarious high-wire act, balancing business, family, and encroaching adversaries on all sides in his relentless pursuit of the ultimate win.",41077,A24,8,2019,50000000,This is how I win.,Martin Scorsese,Adam Sandler,19292,2,LaKeith Stanfield,1200864,2,Julia Fox,2371446,1,Kevin Garnett,1177652,2,Idina Menzel,19394,1
388,False,True,631194,45000000,"['Crime', 'Drama', 'Thriller']","When an armed, masked gang enter a Manhattan bank, lock the doors and take hostages, the detective assigned to effect their release enters negotiations preoccupied with corruption charges he is facing.",4319,40 Acres and a Mule Filmworks,3,2006,186003591,It looked like the perfect bank robbery. But you can’t judge a crime by its cover.,Spike Lee,Denzel Washington,5292,2,Clive Owen,2296,2,Jodie Foster,1038,1,Christopher Plummer,290,2,Willem Dafoe,5293,2
187,False,True,135179,40000000,"['Thriller', 'Action', 'Crime']","Welcome to Sin City. This town beckons to the tough, the corrupt, the brokenhearted. Some call it dark… Hard-boiled. Then there are those who call it home — Crooked cops, sexy dames, desperate vigilantes. Some are seeking revenge, others lust after redemption, and then there are those hoping for a little of both. A universe of unlikely and reluctant heroes still trying to do the right thing in a city that refuses to care.",7405,Dimension Films,4,2005,158700000,Walk down the right back alley in Sin City and you can find anything...,Robert Rodriguez,Bruce Willis,62,2,Jessica Alba,56731,1,Clive Owen,2296,2,Mickey Rourke,2295,2,Rutger Hauer,585,2
596161,False,False,,21000000,"['Drama', 'Thriller', 'Crime', 'Western']","Following the loss of their son, a retired sheriff and his wife leave their Montana ranch to rescue their young grandson from the clutches of a dangerous family living off the grid in the Dakotas.",69686,Mazur / Kaplan Company,11,2020,7997460,Fight for family.,Sandi Cameron,Diane Lane,2882,1,Kevin Costner,1269,2,Kayli Carter,1731341,1,Lesley Manville,72305,1,Will Brittain,1140241,2
511809,False,False,,100000000,"['Drama', 'Romance', 'Crime']","Two youngsters from rival New York City gangs fall in love, but tensions between their respective friends build toward tragedy.",127928,20th Century Studios,12,2021,74500000,,Steven Spielberg,Ansel Elgort,1159982,2,Rachel Zegler,2217977,1,Ariana DeBose,1437491,1,David Alvarez,2225865,2,Mike Faist,1423520,2
9740,False,True,9743,87000000,"['Crime', 'Drama', 'Thriller']","After having successfully eluded the authorities for years, Hannibal peacefully lives in Italy in disguise as an art scholar. Trouble strikes again when he's discovered leaving a deserving few dead in the process. He returns to America to make contact with now disgraced Agent Clarice Starling, who is suffering the wrath of a malicious FBI rival as well as the media.",10308,Dino De Laurentiis Company,2,2001,351692268,His genius undeniable. His evil unspeakable. His name...Hannibal.,Ridley Scott,Anthony Hopkins,4173,2,Julianne Moore,1231,1,Gary Oldman,64,2,Ray Liotta,11477,2,Giancarlo Giannini,3753,2
617,False,True,33059,20000000,"['Mystery', 'Thriller', 'Drama']","When teen-socialite Kelly Van Ryan and troubled bad girl Suzie Toller accuse guidance counselor Sam Lombardo of rape, he's suspended by the school, rejected by the town, and fighting to get his life back. One cop suspects conspiracy, but nothing is what it seems...",1236,Mandalay Entertainment,3,1998,67200000,They're dying to play with you.,John McNaughton,Kevin Bacon,4724,2,Matt Dillon,2876,2,Neve Campbell,9206,1,Denise Richards,9205,1,Theresa Russell,9207,1
3131,False,False,,100000000,"['Drama', 'History', 'Crime']","In 1863, Amsterdam Vallon returns to the Five Points of America to seek vengeance against the psychotic gangland kingpin, Bill the Butcher, who murdered his father years earlier. With an eager pickpocket by his side and a whole new army, Vallon fights his way to seek vengeance on the Butcher and restore peace in the area.",14,Miramax,12,2002,193800000,America was born in the streets.,Martin Scorsese,Leonardo DiCaprio,6193,2,Daniel Day-Lewis,11856,2,Cameron Diaz,6941,1,Jim Broadbent,388,2,John C. Reilly,4764,2
161,False,True,304,85000000,"['Thriller', 'Crime']","Less than 24 hours into his parole, charismatic thief Danny Ocean is already rolling out his next plan: In one night, Danny's hand-picked crew of specialists will attempt to steal more than $150 million from three Las Vegas casinos. But to score the cash, Danny risks his chances of reconciling with ex-wife, Tess.",174,Warner Bros. Pictures,12,2001,450717150,They're having so much fun it's illegal.,Steven Soderbergh,George Clooney,1461,2,Matt Damon,1892,2,Andy García,1271,2,Brad Pitt,287,2,Julia Roberts,1204,1
524369,False,False,,50000000,"['Crime', 'Drama']","Young Anthony Soprano is growing up in one of the most tumultuous eras in Newark, N.J., history, becoming a man just as rival gangsters start to rise up and challenge the all-powerful DiMeo crime family. Caught up in the changing times is the uncle he idolizes, Dickie Moltisanti, whose influence over his nephew will help shape the impressionable teenager into the all-powerful mob boss, Tony Soprano.",7429,HBO Films,9,2021,13037403,Who made Tony Soprano?,Alan Taylor,Alessandro Nivola,4941,2,Leslie Odom Jr.,1254614,2,Michael Gandolfini,1900369,2,Ray Liotta,11477,2,Michela De Rossi,1977918,1
446021,False,False,,32000000,"['Thriller', 'Drama', 'Mystery', 'Crime']","Lake Tahoe, 1969. Seven strangers, each one with a secret to bury, meet at El Royale, a decadent motel with a dark past. In the course of a fateful night, everyone will have one last shot at redemption.",25,20th Century Fox,10,2018,31882724,All roads lead here,Paul Barry,Jeff Bridges,1229,2,Cynthia Erivo,1765068,1,Lewis Pullman,1700685,2,Dakota Johnson,118545,1,Cailee Spaeny,1683343,1
9277,False,True,330605,5500000,"['Comedy', 'Crime', 'Drama']",A novice con man teams up with an acknowledged master to avenge the murder of a mutual friend by pulling off the ultimate big con and swindling a fortune from a big-time mobster.,33,Universal Pictures,12,1973,159616327,...all it takes is a little confidence.,George Roy Hill,Paul Newman,3636,2,Robert Redford,4135,2,Robert Shaw,8606,2,Charles Durning,1466,2,Ray Walston,4093,2
793,False,False,,6000000,"['Crime', 'Drama', 'Mystery', 'Thriller']","Clean-cut Jeffrey Beaumont realizes his hometown is not so normal when he discovers a human ear in a field, the investigation soon catapulting him toward a disturbed nightclub singer and a drug-addicted sadist.",484,DEG,9,1986,8636706,It's a strange world.,David Lynch,Kyle MacLachlan,6677,2,Isabella Rossellini,6588,1,Laura Dern,4784,1,Dennis Hopper,2778,2,Hope Lange,3382,1
4771,False,False,,19000000,"['Crime', 'Drama', 'Mystery']","When 4 year old Amanda McCready disappears from her home and the police make little headway in solving the case, the girl's aunt, Beatrice McCready hires two private detectives, Patrick Kenzie and Angie Gennaro. The detectives freely admit that they have little experience with this type of case, but the family wants them for two reasons—they're not cops and they know the tough neighborhood in which they all live.",14,Miramax,9,2007,34600000,Everyone wants the truth... until they find it.,Terrence Malick,Casey Affleck,1893,2,Michelle Monaghan,11705,1,Morgan Freeman,192,2,Ed Harris,228,2,John Ashton,778,2
1640,False,False,,6500000,['Drama'],"In post-Sept. 11 Los Angeles, tensions erupt when the lives of a Brentwood housewife, her district attorney husband, a Persian shopkeeper, two cops, a pair of carjackers and a Korean couple converge during a 36-hour period.",1632,Lionsgate,5,2005,98400000,"Moving at the speed of life, we are bound to collide with each other.",James Cameron,Sandra Bullock,18277,1,Don Cheadle,1896,2,Matt Dillon,2876,2,Michael Peña,454,2,Jennifer Esposito,18285,1
65754,False,True,575987,90000000,"['Thriller', 'Crime', 'Mystery']","Disgraced journalist Mikael Blomkvist investigates the disappearance of a weary patriarch's niece from 40 years ago. He is aided by the pierced, tattooed, punk computer hacker named Lisbeth Salander. As they work together in the investigation, Blomkvist and Salander uncover immense corruption beyond anything they have ever imagined.",5,Columbia Pictures,12,2011,232600000,"What is hidden in snow, comes forth in the thaw.",David Fincher,Daniel Craig,8784,2,Rooney Mara,108916,1,Christopher Plummer,290,2,Stellan Skarsgård,1640,2,Robin Wright,32,1
11423,False,False,,2800000,"['Crime', 'Drama', 'Thriller']","During the late 1980s, two detectives in a South Korean province attempt to solve the nation's first series of rape-and-murder cases.",7036,CJ Entertainment,5,2003,26000000,The worst of them will stay with you... forever.,Bong Joon-ho,Song Kang-ho,20738,2,Kim Sang-kyung,69378,2,Kim Roi-ha,69379,2,Song Jae-ho,1080904,2,Byun Hee-bong,116180,2
1574,False,False,,45000000,"['Comedy', 'Crime', 'Drama']",Murderesses Velma Kelly and Roxie Hart find themselves on death row together and fight for the fame that will keep them from the gallows in 1920s Chicago.,14,Miramax,12,2002,306776732,"If you can't be famous, be infamous.",Bill Condon,Renée Zellweger,9137,1,Catherine Zeta-Jones,1922,1,Richard Gere,1205,2,Queen Latifah,15758,1,John C. Reilly,4764,2
398173,False,False,,9800000,"['Drama', 'Horror', 'Crime', 'Thriller']","Failed architect, engineer and vicious murderer Jack narrates the details of some of his most elaborately orchestrated crimes, each of them a towering piece of art that defines his life's work as a serial killer for twelve years.",76,Zentropa Entertainments,7,2018,5566776,,Lars von Trier,Matt Dillon,2876,2,Bruno Ganz,2310,2,Uma Thurman,139,1,Siobhan Fallon Hogan,6751,1,Sofie Gråbøl,1564,1
2118,False,False,,35000000,"['Crime', 'Mystery', 'Thriller']",Three detectives in the corrupt and brutal L.A. police force of the 1950s use differing methods to uncover a conspiracy behind the shotgun slayings of the patrons at an all-night diner.,508,Regency Enterprises,9,1997,126200000,Everything is suspect... Everyone is for sale... And nothing is what it seems.,Curtis Hanson,Russell Crowe,934,2,Guy Pearce,529,2,Kevin Spacey,1979,2,Kim Basinger,326,1,Danny DeVito,518,2
