tmdb_id,adult,belongs_to_collection,collection_id,budget,genres,overview,production_company_id,production_company_name,release_month,release_year,revenue,tagline,director,actor_0_name,actor_0_id,actor_0_gender,actor_1_name,actor_1_id,actor_1_gender,actor_2_name,actor_2_id,actor_2_gender,actor_3_name,actor_3_id,actor_3_gender,actor_4_name,actor_4_id,actor_4_gender
2768,False,False,,5000000,"['Crime', 'Drama', 'Mystery']","Julian makes a lucrative living as an escort to older women in the Los Angeles area. He begins a relationship with Michelle, a local politician's wife, without expecting any pay. One of his clients is murdered and Detective Sunday begins pumping him for details on his different clients, something he is reluctant to do considering the nature of his work. Julian begins to suspect he's being framed. Meanwhile Michelle begins to fall in love with him.",4,Paramount,2,1980,52700000,He's the highest paid lover in Beverly Hills. He leaves women feeling more alive than they've ever felt before. Except one.,Cynnie Troup,Richard Gere,1205,2,Lauren Hutton,27964,1,Hector Elizondo,1210,2,Nina van Pallandt,41732,1,Bill Duke,1103,2
910,False,False,,1600000,"['Mystery', 'Crime', 'Thriller']","Private Investigator Philip Marlowe is hired by wealthy General Sternwood regarding a matter involving his youngest daughter Carmen. Before the complex case is over, Marlowe sees murder, blackmail, deception, and what might be love.",174,Warner Bros. Pictures,8,1946,4900000,The picture they were born for!,Howard Hawks,Humphrey Bogart,4110,2,Lauren Bacall,7570,1,John Ridgely,2673,2,Martha Vickers,13975,1,Elisha Cook Jr.,3339,2
109439,False,True,86119,103000000,['Comedy'],"This time, there's no wedding. No bachelor party. What could go wrong, right? But when the Wolfpack hits the road, all bets are off.",3527,Green Hat Films,5,2013,362000072,It all ends.,Todd Phillips,Bradley Cooper,51329,2,Ed Helms,27105,2,Zach Galifianakis,58225,2,Justin Bartha,21180,2,Ken Jeong,83586,2
13483,False,False,,86000000,"['Thriller', 'Crime', 'Mystery']","While undergoing heart surgery, a man experiences a phenomenon called ‘anesthetic awareness’, which leaves him awake but paralyzed throughout the operation. As various obstacles present themselves, his wife must make life-altering decisions while wrestling with her own personal drama.",308,The Weinstein Company,11,2007,14373825,"Every year, one in 700 people wake up during surgery.",Adam Roffman,Hayden Christensen,17244,2,Jessica Alba,56731,1,Terrence Howard,18288,2,Lena Olin,5313,1,Christopher McDonald,4443,2
84188,False,False,,270000,"['Drama', 'Thriller']","On a particularly busy day at a suburban Ohio fast food restaurant, manager Sandra receives a phone call from a police officer saying that an employee has stolen money from a customer.",12649,Bad Cop / Bad Cop,8,2012,592116,How far would you go?,David Gordon Green,Ann Dowd,43366,1,Dreama Walker,74303,1,Pat Healy,60846,2,Bill Camp,121718,2,Philip Ettinger,211991,2
298250,False,True,656,10000000,"['Horror', 'Mystery', 'Thriller']","Law enforcement finds itself chasing the ghost of a man dead for over a decade, embroiled in a diabolical new game that's only just begun.",2061,Twisted Pictures,10,2017,102952888,The game continues.,James Wan,Matt Passmore,1228915,2,Tobin Bell,2144,2,Callum Keith Rennie,540,2,Hannah Anderson,1685904,1,Clé Bennett,957076,2
687,False,False,,11000000,['Drama'],A death row inmate turns for spiritual guidance to a local nun in the days leading up to his scheduled execution for the murders of a young couple.,406,Havoc,12,1995,39363635,,Sam Hoffman,Susan Sarandon,4038,1,Sean Penn,2228,2,Robert Prosky,10360,2,Raymond J. Barry,10361,2,R. Lee Ermey,8655,2
11293,False,False,,2500000,"['Comedy', 'Crime', 'Drama']","A bible salesman finds himself saddled with a young girl who may or may not be his daughter, and the two forge an unlikely partnership as a money-making con team in Depression-era Kansas.",14120,The Directors Company,5,1973,30900000,"As P.T. Barnum put it, ""There's a sucker born every minute.""",Frank Marshall,Tatum O'Neal,68890,1,Ryan O'Neal,31070,2,Madeline Kahn,29803,1,John Hillerman,12296,2,Jessie Lee Fulton,90844,1
109091,False,False,,25000000,"['Thriller', 'Crime', 'Drama']",A lawyer finds himself in far over his head when he attempts to get involved in drug trafficking.,1645,Scott Free Productions,10,2013,71009334,Sin is a choice.,Ridley Scott,Michael Fassbender,17288,2,Penélope Cruz,955,1,Cameron Diaz,6941,1,Javier Bardem,3810,2,Brad Pitt,287,2
9559,False,False,,30000000,"['Drama', 'Crime']","A kidnapped boy strikes up a friendship with his captor: an escaped convict on the run from the law, headed by an honorable U.S. Marshal.",171,Malpaso Productions,11,1993,135100000,A convict. A cop. A hostage that will make one of them a hero.,John Lee Hancock,Kevin Costner,1269,2,Clint Eastwood,190,2,Laura Dern,4784,1,T.J. Lowther,64025,2,Bradley Whitford,11367,2
426563,False,False,,42000000,"['Mystery', 'Adventure', 'Comedy', 'Crime']","Detective Sherlock Holmes and Dr. John Watson join forces to investigate a murder at Buckingham Palace. They soon learn that they have only four days to solve the case, or the queen will become the next victim.",5,Columbia Pictures,12,2018,40500000,They don't have a clue.,Adam McKay,Will Ferrell,23659,2,John C. Reilly,4764,2,Rebecca Hall,15556,1,Kelly Macdonald,9015,1,Rob Brydon,47632,2
449562,False,False,,21000000,"['Comedy', 'Crime']","Two female scam artists, one low rent and the other high class, compete to swindle a naïve tech prodigy out of his fortune. A remake of the 1988 comedy ""Dirty Rotten Scoundrels.""",79566,Pin High,5,2019,97400000,They're giving dirty rotten men a run for their money.,Mark Goddard,Anne Hathaway,1813,1,Rebel Wilson,221581,1,Alex Sharp,136127,2,Ingrid Oliver,222051,1,Hannah Waddingham,1278487,1
536743,False,False,,20000000,"['Drama', 'Romance', 'Crime']","While on a forgettable first date together in Ohio, a black man and a black woman are pulled over for a minor traffic infraction. The situation escalates, with sudden and tragic results.",101758,Hillman Grad Productions,11,2019,47803176,"Two souls on the run, bound by love and fueled by freedom.",H.H. Cooper,Daniel Kaluuya,206919,2,Jodie Turner-Smith,1695989,1,Bokeem Woodbine,71913,2,Chloë Sevigny,2838,1,Flea,1237,2
30018,False,False,,5000000,"['Crime', 'Drama', 'Mystery']","A mother lives quietly with her son. One day, a girl is brutally killed, and the boy is charged with the murder. Now, it's his mother's mission to prove him innocent.",4399,Barunson E&A,5,2009,17112713,She'll stop at nothing.,Bong Joon-ho,Kim Hye-ja,126478,1,Won Bin,70336,2,Jin Goo,1299287,2,Yoon Je-moon,141541,2,Jeon Mi-seon,994248,1
521,False,False,,1400000,"['Thriller', 'Crime']","An ex-tennis pro carries out a plot to have his wealthy wife murdered after discovering she is having an affair, and assumes she will soon leave him for the other man anyway.",174,Warner Bros. Pictures,5,1954,3000000,Is this the man she was waiting for... or the man who was waiting for her?,Alfred Hitchcock,Ray Milland,7124,2,Grace Kelly,4070,1,Robert Cummings,7125,2,John Williams,5182,2,Anthony Dawson,7682,2
13685,False,False,,7000000,"['Comedy', 'Crime', 'Drama']","Upon his release from a mental hospital following a nervous breakdown, the directionless Anthony joins his friend Dignan, who seems far less sane than the former. Dignan has hatched a harebrained scheme for an as-yet-unspecified crime spree that somehow involves his former boss, the (supposedly) legendary Mr. Henry.",18,Gracie Films,2,1996,1040879,"They're not really criminals, but everyone's got to have a dream.",Wes Anderson,Luke Wilson,36422,2,Owen Wilson,887,2,Robert Musgrave,52797,0,Lumi Cavazos,74940,1,James Caan,3085,2
284536,False,False,,25000000,"['Thriller', 'Crime', 'Drama']","Literature professor Jim Bennett leads a secret life as a high-stakes gambler. Always a risk-taker, Bennett bets it all when he borrows from a gangster and offers his own life as collateral. Staying one step ahead, he pits his creditor against the operator of an illicit gambling ring while garnering the attention of Frank, a paternalistic loan shark. As his relationship with a student deepens, Bennett must risk everything for a second chance.",4,Paramount,12,2014,39171130,The only way out is all in,Rupert Wyatt,Mark Wahlberg,13240,2,John Goodman,1230,2,Brie Larson,60073,1,Michael Kenneth Williams,39390,2,George Kennedy,12950,2
511322,False,False,,10000000,['Crime'],"Career con man Roy sets his sights on his latest mark: recently widowed Betty, worth millions. And he means to take it all. But as the two draw closer, what should have been another simple swindle takes on the ultimate stakes.",209747,1000 Eyes,11,2019,33856058,Read between the lies.,Bill Condon,Helen Mirren,15735,1,Ian McKellen,1327,2,Russell Tovey,55469,2,Jim Carter,20070,2,Mark Lewis Jones,185460,2
11615,False,False,,50000000,"['Drama', 'Thriller', 'Crime']",A man against capital punishment is accused of murdering a fellow activist and is sent to death row.,24,Mikona Productions,2,2003,38955598,The crime is clear. The truth is not.,Alan Parker,Kevin Spacey,1979,2,Kate Winslet,204,1,Laura Linney,350,1,Rhona Mitra,25702,1,Gabriel Mann,32458,2
9275,False,False,,55000000,"['Comedy', 'Crime', 'Drama', 'Thriller']","Tells the story of Rainbow Randolph, the corrupt, costumed star of a popular children's TV show, who is fired over a bribery scandal and replaced by squeaky-clean Smoochy, a puffy fuchsia rhinoceros. As Smoochy catapults to fame - scoring hit ratings and the affections of a network executive - Randolph makes the unsuspecting rhino the target of his numerous outrageous attempts to exact revenge and reclaim his status as America's sweetheart.",174,Warner Bros. Pictures,3,2002,8400000,Get ready for an unexpected hit.,Wilma Garscadden-Gahret,Robin Williams,2157,2,Edward Norton,819,2,Catherine Keener,2229,1,Danny DeVito,518,2,Jon Stewart,12219,2
334524,False,False,,20000000,"['Adventure', 'Drama', 'Thriller']","Kenny Wells, a modern-day prospector, hustler, and dreamer, is desperate for a lucky break. Left with few options, Wells teams up with an equally luckless geologist to execute a grandiose, last-ditch effort: to find gold deep in the uncharted jungle of Indonesia.",2877,Living Films,2,2016,14880939,Prove 'em all wrong,Jan Rudolph,Matthew McConaughey,10297,2,Bryce Dallas Howard,18997,1,Edgar Ramírez,25616,2,Timothy Simons,1181329,2,Michael Landes,57428,2
157849,False,False,,15000000,['Thriller'],A Chechen Muslim illegally immigrates to Hamburg and becomes a person of interest for a covert government team which tracks the movements of potential terrorists.,36616,Amusement Park Films,7,2014,31554855,,Anton Corbijn,Philip Seymour Hoffman,1233,2,Willem Dafoe,5293,2,Robin Wright,32,1,Rachel McAdams,53714,1,Grigoriy Dobrygin,107722,2
16161,False,False,,16000000,"['Crime', 'Drama', 'Romance', 'Thriller']","The story of Jody, a misguided, 20-year-old African-American who is really just a baby boy finally forced-kicking and screaming to face the commitments of real life. Streetwise and jobless, he has not only fathered two children by two different women-Yvette and Peanut but still lives with his own mother. He can't seem to strike a balance or find direction in his chaotic life.",1947,New Deal Productions,6,2001,29381649,Just a Baby Boy.,John Singleton,Tyrese Gibson,8169,2,Taraji P. Henson,40036,1,Omar Gooding,88183,2,Ving Rhames,10182,2,Snoop Dogg,19767,2
2322,False,False,,23000000,"['Comedy', 'Crime', 'Drama']","When shadowy U.S. intelligence agents blackmail a reformed computer hacker and his eccentric team of security experts into stealing a code-breaking 'black box' from a Soviet-funded genius, they uncover a bigger conspiracy. Now, he and his 'sneakers' must save themselves and the world economy by retrieving the box from their blackmailers.",33,Universal Pictures,9,1992,105232691,"We could tell you what it's about. But then, of course, we'd have to kill you.",Nandi Bowe,Robert Redford,4135,2,Sidney Poitier,16897,2,David Strathairn,11064,2,Dan Aykroyd,707,2,River Phoenix,741,2
8012,False,True,91698,30250000,"['Comedy', 'Thriller', 'Crime']","Chili Palmer is a Miami mobster who gets sent by his boss, the psychopathic ""Bones"" Barboni, to collect a bad debt from Harry Zimm, a Hollywood producer who specializes in cheesy horror films. When Chili meets Harry's leading lady, the romantic sparks fly. After pitching his own life story as a movie idea, Chili learns that being a mobster and being a Hollywood producer really aren't all that different.",21,Metro-Goldwyn-Mayer,10,1995,115101622,Attitude plays a part.,Barry Sonnenfeld,John Travolta,8891,2,Gene Hackman,193,2,Rene Russo,14343,1,Danny DeVito,518,2,Dennis Farina,1117,2
21629,False,False,,10000000,['Comedy'],"New Yorkers Skip Donahue and Harry Monroe have no jobs and no prospects, so they decide to flee the city and find work elsewhere, landing jobs wearing woodpecker costumes to promote the opening of a bank. When their feathery costumes are stolen and used in a bank robbery, they no longer have to worry about employment — they're sent to prison.",5,Columbia Pictures,12,1980,101300000,Two jailbirds who just want out of the cage.,Daniel McCauley,Gene Wilder,3460,2,Richard Pryor,9309,2,Georg Stanford Brown,14065,2,JoBeth Williams,10080,1,Miguel Ángel Suárez,87743,2
11027,False,False,,12000000,"['Crime', 'Romance', 'Drama', 'Thriller']",The sensuous wife of a lunch wagon proprietor and a rootless drifter begin a sordidly steamy affair and conspire to murder her Greek husband.,14309,CIP Filmproduktion GmbH,3,1981,12376625,You can get away with anything. Once.,Graeme Clifford,Jack Nicholson,514,2,Jessica Lange,4431,1,John Colicos,15765,2,Michael Lerner,4250,2,John P. Ryan,15213,2
10778,False,False,,20000000,"['Crime', 'Drama']","A tale of murder, crime and punishment set in the summer of 1949. Ed Crane, a barber in a small California town, is dissatisfied with his life, but his wife Doris' infidelity and a mysterious opportunity presents him with a chance to change it.",10565,Good Machine,10,2001,18900000,The last thing on his mind is murder.,Joel Coen,Billy Bob Thornton,879,2,Frances McDormand,3910,1,Michael Badalucco,1010,2,James Gandolfini,4691,2,Katherine Borowitz,171379,1
13715,False,False,,6500000,"['Crime', 'Drama', 'Thriller']","Brad Whitewood Jr. lives in rural Pennsylvania and has few prospects. Against his mother's wishes, he seeks out his estranged father, the head of a gang of thieves in a nearby town. Though his new girlfriend supports his criminal ambitions, Brad Jr. soon learns that his father is a dangerous man. Inspired by the real events that led to the end of the Johnston Gang, who operated in the northeastern United States in the 1970s.",469,Hemdale Film Corporation,4,1986,2347000,Like father. Like son. Like hell.,James Foley,Sean Penn,2228,2,Christopher Walken,4690,2,Mary Stuart Masterson,31140,1,Chris Penn,2969,2,Millie Perkins,26142,1
466,False,False,,2500000,"['Thriller', 'Mystery', 'Crime']",A high-priced call girl is forced to depend on a reluctant private eye when she is stalked by a psychopath.,6174,Gus Productions,6,1971,12512637,You'd never take her for a call girl. You'd never take him for a cop.,Alan J. Pakula,Jane Fonda,6352,1,Donald Sutherland,55636,2,Charles Cioffi,6354,2,Roy Scheider,6355,2,Dorothy Tristan,6360,1
11377,False,True,248339,37000000,['Horror'],An amusement park mogul offers a random group of diverse people $1 million to spend the night in a decrepit former mental institution.,1786,Dark Castle Entertainment,10,1999,40846082,Evil loves to party.,Robert Zemeckis,Geoffrey Rush,118,2,Famke Janssen,10696,1,Ali Larter,17303,1,Taye Diggs,17637,2,Chris Kattan,58317,2
9072,False,False,,64000000,"['Comedy', 'Crime']","After leaving the prison, the dwarf criminal Calvin Sims joins to his moron brother Percy to steal an expensive huge diamond in a jewelry for the mobster Walken. They are chased by the police, and Calvin hides the stone in the purse of the executive Vanessa Edwards, whose husband Darryl Edwards wants to have a baby. Percy convinces Calvin to dress like a baby and be left in front of the Edwards's house to get inside the house and retrieve the diamond. Darryl and Vanessa keep Calvin for the weekend and decide to adopt him, while Walken threatens Darryl to get the stone back.",1608,Wayans Bros. Entertainment,8,2006,101600000,Big things come in small packages,Stephanie Rossel,Marlon Wayans,9562,2,Shawn Wayans,35690,2,Kerry Washington,11703,1,John Witherspoon,56902,2,Tracy Morgan,56903,2
12093,False,False,,4600000,"['Crime', 'Drama']","Lilja lives in poverty and dreams of a better life. Her mother moves to the United States and abandons her to her aunt, who neglects her. Lilja hangs out with her friends, Natasha and Volodya, who is suicidal. Desperate for money, she starts working as a prostitute, and later meets Andrei. He offers her a good job in Sweden, but when Lilja arrives her life quickly enters a downward spiral.",321,Memfis Film,8,2002,1007747,,Lukas Moodysson,Oksana Akinshina,77667,1,Artyom Bogucharsky,71219,2,Lyubov Agapova,71220,1,Liliya Shinkaryova,71221,1,Elina Benenson,71222,1
12281,False,False,,500000,"['Crime', 'Drama']","Teenagers living in small-town Oregon take a boat trip for a birthday celebration. When they get an idea to play a mean trick on the town bully, it suddenly goes too far. Soon they're forced to deal with the unexpected consequences of their actions.",3095,Whitewater Films,8,2004,603943,"Beneath the surface, everyone has a secret.",Rick Rosenthal,Rory Culkin,28042,2,Scott Mechlowicz,41464,2,Trevor Morgan,4940,2,Josh Peck,15760,2,Ryan Kelley,23891,2
35056,False,False,,55000000,"['Comedy', 'Action', 'Adventure']","Phil and Claire Foster fear that their mild-mannered relationship may be falling into a stale rut. During their weekly date night, their dinner reservation leads to their being mistaken for a couple of thieves—and now a number of unsavoury characters want Phil and Claire killed.",444,Dune Entertainment,4,2010,152300000,One ordinary couple. One little white lie.,Shawn Levy,Steve Carell,4495,2,Tina Fey,56323,1,Mark Wahlberg,13240,2,Taraji P. Henson,40036,1,Jimmi Simpson,22125,2
1580,False,False,,1500000,"['Thriller', 'Crime', 'Drama']","Two men murder a man in cold blood for the thrill and invite his parents over for a celebration to prove they have committed the perfect crime, but they also have to deal with their former schoolmaster, who becomes suspicious.",1554,Transatlantic Pictures,3,1948,2200000,"It begins with a shriek...it ends with a shot! From beginning to end, nothing ever held you like Alfred Hitchcock's ROPE!",Alfred Hitchcock,James Stewart,854,2,John Dall,14504,2,Farley Granger,12497,2,Edith Evanson,17662,1,Joan Chandler,17664,1
36593,False,True,37139,30000000,"['Comedy', 'Crime']","Frank Drebin is persuaded out of retirement to go undercover in a state prison. There he has to find out what top terrorist, Rocco, has planned for when he escapes. Adding to his problems, Frank's wife, Jane, is desperate for a baby.",4,Paramount,3,1994,132000000,Mostly all new jokes.,Peter Segal,Leslie Nielsen,7633,2,Priscilla Presley,12949,1,George Kennedy,12950,2,O.J. Simpson,12951,2,Fred Ward,10430,2
7270,False,False,,62000000,"['Comedy', 'Drama', 'Crime', 'Thriller']",A phobic con artist and his protege are on the verge of pulling off a lucrative swindle when the con artist's teenage daughter arrives unexpectedly.,174,Warner Bros. Pictures,9,2003,65565672,Lie. Cheat. Steal. Rinse. Repeat.,Robert Zemeckis,Nicolas Cage,2963,2,Sam Rockwell,6807,2,Alison Lohman,8291,1,Bruce Altman,27545,2,Bruce McGill,14888,2
10141,False,False,,6500000,"['Crime', 'Comedy']","Two con men try to settle their rivalry by betting on who can be the first to swindle a young American heiress out of $50,000.",41,Orion Pictures,12,1988,42000000,Nice guys finish last. Meet the winners.,,Steve Martin,67773,2,Michael Caine,3895,2,Glenne Headly,21104,1,Anton Rodgers,28853,2,Barbara Harris,30618,1
13195,False,False,,20000000,"['Crime', 'Drama', 'Thriller']","A female executive and a night janitor conspire to commit a daring diamond heist from their mutual employer, The London Diamond Corporation.",1030,Magnolia Pictures,9,2007,6819587,,Michael Radford,Demi Moore,3416,1,Michael Caine,3895,2,Lambert Wilson,2192,2,Nathaniel Parker,27631,2,Shaughan Seymour,30326,2
44629,False,False,,5000000,"['Crime', 'Drama']","Joshua “J” is taken in by his extended family after his mother dies of an overdose. The clan, ruled by J’s scheming grandmother, is heavily involved in criminal activities, and J is soon indoctrinated into their way of life. But J is given a chance to take another path when a cop seeks to help him.",6237,Porchlight Films,6,2010,1000000,A crime story,David Michôd,Ben Mendelsohn,77335,2,Joel Edgerton,33192,2,Guy Pearce,529,2,Luke Ford,55900,2,Jacki Weaver,67837,1
257091,False,False,,40000000,['Comedy'],"When obscenely rich hedge-fund manager James is convicted of fraud and sentenced to a stretch in San Quentin, the judge gives him one month to get his affairs in order. Knowing that he won't survive more than a few minutes in prison on his own, James desperately turns to Darnell-- a black businessman who's never even had a parking ticket -- for help. As Darnell puts James through the wringer, both learn that they were wrong about many things, including each other.",4740,Gary Sanchez Productions,3,2015,111800000,An education in incarceration.,Adam McKay,Will Ferrell,23659,2,Kevin Hart,55638,2,Alison Brie,88029,1,Craig T. Nelson,8977,2,T.I.,76126,2
12143,False,False,,1000000,"['Crime', 'Drama']","While investigating a young nun's rape, a corrupt New York City police detective, with a serious drug and gambling addiction, tries to change his ways and find forgiveness.",11264,Bad Lt. Productions,11,1992,2019469,Gambler. Thief. Junkie. Killer. Cop.,Abel Ferrara,Harvey Keitel,1037,2,Brian McElroy,1115016,0,Frankie Acciarito,1115017,0,Peggy Gormley,46397,1,Stella Keitel,209069,1
188166,False,False,,420000,"['Crime', 'Thriller']","When the quiet life of a beach bum is upended by dreadful news, he sets off for his childhood home to carry out an act of vengeance. However, he proves an inept assassin and finds himself in a brutal fight to protect his estranged family.",28360,Paradise City,4,2014,993313,Revenge comes home,Jeremy Saulnier,Macon Blair,209513,2,Devin Ratray,11516,2,Amy Hargreaves,92728,1,Kevin Kolack,1194965,2,Eve Plumb,1212485,1
9384,False,False,,60000000,"['Comedy', 'Crime']","Join uptight David Starsky and laid-back Ken ""Hutch"" Hutchinson as they're paired for the first time as undercover cops. The new partners must overcome their differences to solve an important case with help from street informant Huggy Bear and persuasive criminal Reese Feldman.",174,Warner Bros. Pictures,3,2004,170300000,They're the man.,Todd Phillips,Ben Stiller,7399,2,Owen Wilson,887,2,Snoop Dogg,19767,2,Vince Vaughn,4937,2,Fred Williamson,9811,2
11081,False,False,,45000000,['Thriller'],"Recruited to assist Montreal police in their desperate search for a serial killer who assumes the identities of his victims, FBI profiler Illeana Scott knows it's only a matter of time before the killer strikes again. Her most promising lead is a museum employee who might be the killer's only eyewitness.",79,Village Roadshow Pictures,3,2004,65470529,He would kill to be you.,D. J. Caruso,Angelina Jolie,11701,1,Ethan Hawke,569,2,Kiefer Sutherland,2628,2,Gena Rowlands,4800,1,Olivier Martinez,15533,2
11843,False,True,937,5000000,"['Comedy', 'Crime', 'Mystery']",The famous Pink Panther jewel has once again been stolen and Inspector Clouseau is called in to catch the thief. The Inspector is convinced that 'The Phantom' has returned and utilises all of his resources – himself and his Asian manservant – to reveal the identity of 'The Phantom'.,60,United Artists,5,1975,41833347,,Peter MacDonald,Peter Sellers,12446,2,Christopher Plummer,290,2,Catherine Schell,18915,1,Herbert Lom,14503,2,Peter Arne,14955,2
527,False,True,300546,950000,['Drama'],"A drama about a Maori family living in Auckland, New Zealand. Lee Tamahori tells the story of Beth Heke’s strong will to keep her family together during times of unemployment and abuse from her violent and alcoholic husband.",293,Avalon Studios,9,1994,6700000,"A family in crisis, a life in chaos... Nothing is more powerful than a mother's love.",Lee Tamahori,Rena Owen,7241,1,Temuera Morrison,7242,2,Mamaengaroa Kerr-Bell,7243,1,Julian Arahanga,7244,2,Taungaroa Emile,7245,2
534780,False,False,,4500000,"['Crime', 'Mystery', 'Thriller', 'Comedy']",A series of mysterious events changes the life of a blind pianist who now must report a crime that was actually never witnessed by him.,6808,Viacom18 Studios,10,2018,40000000,Every artist has a secret.,Sriram Raghavan,Ayushmann Khurrana,1033157,2,Radhika Apte,223167,1,Tabu,55062,1,Anil Dhawan,1033068,2,Rashmi Agdekar,2408210,1
10279,False,False,,22000000,"['Thriller', 'Drama', 'Crime']","During the summer of 1977, a killer known as the Son of Sam keeps all of New York City on edge with a series of brutal murders.",4319,40 Acres and a Mule Filmworks,7,1999,19288130,No one is safe from Son of Sam.,Spike Lee,John Leguizamo,5723,2,Adrien Brody,3490,2,Mira Sorvino,23931,1,Jennifer Esposito,18285,1,Michael Rispoli,18313,2
10476,False,False,,8000000,"['Crime', 'Drama', 'Music']","With help from his friends, a Memphis pimp in a mid-life crisis attempts to become a successful hip-hop emcee.",746,MTV Films,7,2005,23563727,Everybody gotta have a dream.,John Singleton,Terrence Howard,18288,2,Anthony Anderson,18471,2,Taryn Manning,343,1,Taraji P. Henson,40036,1,DJ Qualls,132078,2
